<?xml version="1.0" encoding="UTF-8"?>
<person xmlns:xsi="http://www.w3.org/2001/XMLSchema-instance" 
    xsi:noNamespaceSchemaLocation="person.xsd">
    <name>Frank Days</name>
    <age>29</age>
    <city>Orlando</city>
    <phone>321-948-9579</phone>
    <phone>333-333-3333</phone>
    <email>days@gmail.com</email>
    <citizen />
</person>